{
  "schema": "VPCorpusMap/v1",
  "revision": 447,
  "updated_at": "2026-10-20T08:34:27.267Z",
  "donors": {
    "superpowers": {
      "source_revision": "bb92a77741419a4ab5f06e711a283343f1ada0c3",
      "files": {
        "skills/receiving-code-review/SKILL.md": {
          "status": "split",
          "instruction_ids": [
            "apply-code-review",
            "avoid-performative-review-agreement",
            "check-requested-feature-usage"
          ]
        },
        "skills/brainstorming/SKILL.md": {
          "status": "split",
          "instruction_ids": [
            "clarify-before-design",
            "ask-one-open-question",
            "choose-visual-or-textual-explanation",
            "offer-context-recon",
            "play-back-understanding-in-chunks",
            "size-and-gate-the-work",
            "spike-throwaway-to-learn",
            "write-design-document"
          ]
        },
        "skills/systematic-debugging/SKILL.md": {
          "status": "split",
          "instruction_ids": [
            "debug-systematically",
            "analyze-working-reference",
            "handle-environmental-cause",
            "instrument-component-boundaries"
          ]
        },
        "skills/subagent-driven-development/SKILL.md": {
          "status": "split",
          "instruction_ids": [
            "delegate-subagent-work",
            "batch-same-shape-tasks",
            "handle-implementer-report",
            "maintain-plan-ledger",
            "review-task-both-verdicts",
            "run-bounded-fix-loop",
            "scan-plan-for-conflicts",
            "select-model-per-task",
            "wait-boundedly-for-workers"
          ]
        },
        "skills/finishing-a-development-branch/SKILL.md": {
          "status": "split",
          "instruction_ids": [
            "integrate-completed-work",
            "clean-up-integration-workspace",
            "present-integration-options",
            "require-explicit-discard-confirmation"
          ]
        },
        "skills/using-git-worktrees/SKILL.md": {
          "status": "converted",
          "instruction_ids": [
            "isolate-work-in-worktree"
          ]
        },
        "skills/dispatching-parallel-agents/SKILL.md": {
          "status": "converted",
          "instruction_ids": [
            "parallelize-independent-tasks"
          ]
        },
        "skills/requesting-code-review/SKILL.md": {
          "status": "converted",
          "instruction_ids": [
            "request-independent-review"
          ]
        },
        "skills/test-driven-development/SKILL.md": {
          "status": "split",
          "instruction_ids": [
            "test-first-development",
            "delete-code-written-before-test",
            "simplify-design-when-tests-are-hard"
          ]
        },
        "skills/verification-before-completion/SKILL.md": {
          "status": "split",
          "instruction_ids": [
            "verify-before-completion",
            "prove-regression-test-detects-bug"
          ]
        },
        "skills/writing-plans/SKILL.md": {
          "status": "split",
          "instruction_ids": [
            "write-implementation-plan",
            "map-file-structure-before-tasks",
            "offer-plan-execution-methods",
            "self-review-plan-against-spec",
            "write-plan-header-and-constraints"
          ]
        },
        "skills/writing-skills/SKILL.md": {
          "status": "split",
          "instruction_ids": [
            "automate-enforceable-rules",
            "close-guidance-loopholes",
            "decide-whether-to-write-guidance",
            "match-guidance-form-to-failure",
            "optimize-guidance-triggers",
            "specify-output-format",
            "structure-and-compress-guidance",
            "test-guidance-against-baseline",
            "write-directive-rules",
            "write-minimal-agent-guidance"
          ]
        },
        "skills/writing-skills/testing-skills-with-subagents.md": {
          "status": "converted",
          "instruction_ids": [
            "test-guidance-against-baseline"
          ]
        },
        "skills/executing-plans/SKILL.md": {
          "status": "split",
          "instruction_ids": [
            "enforce-plan-completion-contract",
            "execute-plan-in-order",
            "record-execution-rulings",
            "resume-plan-from-record",
            "run-final-change-review"
          ]
        },
        "skills/requesting-code-review/code-reviewer.md": {
          "status": "split",
          "instruction_ids": [
            "classify-and-state-review-verdict",
            "keep-review-read-only",
            "review-change-against-requirements",
            "review-code-quality-and-tests"
          ]
        },
        "skills/subagent-driven-development/task-reviewer-prompt.md": {
          "status": "split",
          "instruction_ids": [
            "keep-review-read-only",
            "review-task-both-verdicts"
          ]
        },
        "skills/systematic-debugging/defense-in-depth.md": {
          "status": "converted",
          "instruction_ids": [
            "validate-at-every-boundary"
          ]
        },
        "skills/brainstorming/builder-check-prompt.md": {
          "status": "merged",
          "instruction_ids": [
            "clarify-before-design"
          ],
          "contributed_sources": [
            "superpowers:skills/brainstorming/builder-check-prompt.md"
          ]
        },
        "skills/systematic-debugging/root-cause-tracing.md": {
          "status": "converted",
          "instruction_ids": [
            "debug-systematically"
          ]
        },
        "skills/test-driven-development/writing-good-tests.md": {
          "status": "converted",
          "instruction_ids": [
            "write-tests-that-catch-breaks"
          ]
        },
        "skills/systematic-debugging/condition-based-waiting.md": {
          "status": "converted",
          "instruction_ids": [
            "wait-for-conditions-not-time"
          ]
        },
        ".github/ISSUE_TEMPLATE/bug_report.md": {
          "status": "rejected",
          "reason": "Шаблон форми звернення до репозиторію донора; не методологія."
        },
        ".github/ISSUE_TEMPLATE/diagnosis_report.md": {
          "status": "rejected",
          "reason": "Шаблон форми звернення до репозиторію донора; не методологія."
        },
        ".github/ISSUE_TEMPLATE/feature_request.md": {
          "status": "rejected",
          "reason": "Шаблон форми звернення до репозиторію донора; не методологія."
        },
        ".github/ISSUE_TEMPLATE/platform_support.md": {
          "status": "rejected",
          "reason": "Шаблон форми звернення до репозиторію донора; не методологія."
        },
        ".github/PULL_REQUEST_TEMPLATE.md": {
          "status": "rejected",
          "reason": "Шаблон форми звернення до репозиторію донора; не методологія."
        },
        ".opencode/INSTALL.md": {
          "status": "rejected",
          "reason": "Хостова інструкція встановлення донора; інфраструктура, не норма."
        },
        "AGENTS.md": {
          "status": "rejected",
          "reason": "Домашні правила репозиторію донора для контриб'юторів; переносної норми не містить."
        },
        "CODE_OF_CONDUCT.md": {
          "status": "rejected",
          "reason": "Кодекс поведінки репозиторію; не методологія."
        },
        "docs/plans/2025-11-22-opencode-support-design.md": {
          "status": "rejected",
          "reason": "План робіт донора з його власним контекстом; не норма."
        },
        "docs/plans/2025-11-22-opencode-support-implementation.md": {
          "status": "rejected",
          "reason": "План робіт донора з його власним контекстом; не норма."
        },
        "docs/plans/2025-11-28-skills-improvements-from-user-feedback.md": {
          "status": "rejected",
          "reason": "План робіт донора з його власним контекстом; не норма."
        },
        "docs/plans/2026-01-17-visual-brainstorming.md": {
          "status": "rejected",
          "reason": "План робіт донора з його власним контекстом; не норма."
        },
        "docs/porting-to-a-new-harness.md": {
          "status": "rejected",
          "reason": "Інструкція перенесення донора на інший хост; інфраструктура."
        },
        "docs/README.kimi.md": {
          "status": "rejected",
          "reason": "Хостова інструкція встановлення донора; інфраструктура."
        },
        "docs/README.opencode.md": {
          "status": "rejected",
          "reason": "Хостова інструкція встановлення донора; інфраструктура."
        },
        "docs/superpowers/plans/2026-01-22-document-review-system.md": {
          "status": "rejected",
          "reason": "План робіт донора з його власним контекстом; не норма."
        },
        "docs/superpowers/plans/2026-02-19-visual-brainstorming-refactor.md": {
          "status": "rejected",
          "reason": "План робіт донора з його власним контекстом; не норма."
        },
        "docs/superpowers/plans/2026-03-11-zero-dep-brainstorm-server.md": {
          "status": "rejected",
          "reason": "План робіт донора з його власним контекстом; не норма."
        },
        "docs/superpowers/plans/2026-03-23-codex-app-compatibility.md": {
          "status": "rejected",
          "reason": "План робіт донора з його власним контекстом; не норма."
        },
        "docs/superpowers/plans/2026-04-06-worktree-rototill.md": {
          "status": "rejected",
          "reason": "План робіт донора з його власним контекстом; не норма."
        },
        "docs/superpowers/plans/2026-05-06-lift-drill-into-evals.md": {
          "status": "rejected",
          "reason": "План робіт донора з його власним контекстом; не норма."
        },
        "docs/superpowers/plans/2026-05-07-pi-extension-and-evals.md": {